{
  "$schema": "https://json-schema.org/draft/2020-12/schema",
  "$id": "https://schemas.opus.gresham.com/experience-studio/v1/page-definition.schema.json",
  "title": "Page Definition",
  "description": "One page of an experience: the unit that is generated, edited, validated, versioned and rendered. This is the platform's central contract — the renderer, the visual builder, the validator, the generation service and the migration tooling all bind to it.\n\nThree structural decisions shape the whole document. Components live in a keyed map rather than nested inside the layout, so JSON Patch paths into a component stay stable when siblings are reordered and so two-stage AI generation maps directly onto layout-then-components. Page state is declared explicitly as parameters, filter channels and selection channels, so interaction is expressible in JSON and the renderer can derive the data invalidation graph statically. And nothing here names a physical data object, which is what makes a published page promotable between environments byte-identically.",
  "type": "object",

  "properties": {
    "schemaVersion": { "$ref": "common.schema.json#/$defs/majorMinor" },

    "id": { "$ref": "common.schema.json#/$defs/identifier" },
    "name": { "$ref": "common.schema.json#/$defs/i18nString" },
    "description": { "$ref": "common.schema.json#/$defs/i18nString" },

    "kind": {
      "description": "Page archetype. Drives default layout heuristics, default page actions, and which AI generation exemplars are retrieved. 'workspace' is read plus write-back (v2); 'process' is workflow-hosted (v3) and reserved.",
      "type": "string",
      "enum": ["dashboard", "search", "detail", "workspace", "process", "blank"]
    },

    "route": {
      "description": "Path segment within the experience. Parameters appear as ':name' and must be declared in parameters.",
      "type": "string",
      "pattern": "^[a-z0-9-]+(?:/(?::?[a-z0-9-]+))*$",
      "maxLength": 256
    },

    "parameters": {
      "description": "Typed inputs to the page. URL-synced when scope is 'page' or 'experience', which makes every filtered state deep-linkable — the mechanism by which an analyst sends a colleague the exact view of an exception queue under discussion.",
      "type": "object",
      "propertyNames": { "$ref": "common.schema.json#/$defs/identifier" },
      "additionalProperties": { "$ref": "#/$defs/pageParameter" }
    },

    "filters": {
      "description": "Shared filter channels: declared page state that components read and write. Declaring them rather than letting components hold state is what allows cross-widget filtering to be generated by the AI and analysed by the renderer.",
      "type": "object",
      "propertyNames": { "$ref": "common.schema.json#/$defs/identifier" },
      "additionalProperties": { "$ref": "#/$defs/filterChannel" }
    },

    "selections": {
      "description": "Selection channels — which row, point or node is active. Separate from filters because selection drives detail regions and drill-down rather than narrowing queries.",
      "type": "object",
      "propertyNames": { "$ref": "common.schema.json#/$defs/identifier" },
      "additionalProperties": {
        "type": "object",
        "properties": {
          "label": { "$ref": "common.schema.json#/$defs/i18nString" },
          "mode": { "type": "string", "enum": ["single", "multiple"], "default": "single" },
          "entity": {
            "description": "Catalog entity the selected value identifies. Lets a drilldown action derive its key mapping without the author restating it.",
            "$ref": "common.schema.json#/$defs/qualifiedRef"
          },
          "keyFields": {
            "type": "array",
            "items": { "$ref": "common.schema.json#/$defs/identifier" },
            "maxItems": 8
          },
          "syncToUrl": { "type": "boolean", "default": false }
        },
        "additionalProperties": false
      }
    },

    "dataSources": {
      "description": "Named logical queries available to this page's components.",
      "type": "object",
      "propertyNames": { "$ref": "common.schema.json#/$defs/identifier" },
      "additionalProperties": { "$ref": "data-source.schema.json#/$defs/dataSource" }
    },

    "components": {
      "description": "Component instances keyed by id, referenced from the layout tree. A flat map rather than a nested tree: it keeps patch paths stable, makes impact analysis a simple query, and lets AI generation emit the layout plan and the component configurations as separate stages.",
      "type": "object",
      "propertyNames": { "$ref": "common.schema.json#/$defs/identifier" },
      "additionalProperties": { "$ref": "component-instance.schema.json#/$defs/componentInstance" }
    },

    "layout": {
      "description": "Root of the structural tree. Conventionally a grid container.",
      "$ref": "layout.schema.json#/$defs/layoutNode"
    },

    "overlays": {
      "description": "Drawers and modals not part of the main flow, opened by actions. Kept out of the layout tree so they do not affect grid arrangement.",
      "type": "object",
      "propertyNames": { "$ref": "common.schema.json#/$defs/identifier" },
      "additionalProperties": { "$ref": "layout.schema.json#/$defs/layoutNode" }
    },

    "actions": {
      "description": "Named actions available to this page. Components reference them by id from eventActions; nothing in a component decides what an interaction means.",
      "type": "object",
      "propertyNames": { "$ref": "common.schema.json#/$defs/identifier" },
      "additionalProperties": { "$ref": "action.schema.json#/$defs/action" }
    },

    "navigation": { "$ref": "navigation.schema.json#/$defs/pageNavigation" },

    "security": { "$ref": "security.schema.json#/$defs/artifactSecurity" },

    "presentation": {
      "type": "object",
      "properties": {
        "themeRef": {
          "description": "Design token set. A reference, never inline colours — theming, contrast and dark mode stay under the design system's control, so a generated page cannot produce an inaccessible palette.",
          "type": "string",
          "maxLength": 128
        },
        "density": { "type": "string", "enum": ["comfortable", "compact"], "default": "comfortable" },
        "maxWidth": { "type": "string", "enum": ["contained", "full"], "default": "contained" },
        "showPageHeader": { "type": "boolean", "default": true },
        "headerSummary": {
          "description": "Component rendered in the page header — the record summary on a detail page.",
          "$ref": "common.schema.json#/$defs/localRef"
        }
      },
      "additionalProperties": false
    },

    "localization": {
      "type": "object",
      "properties": {
        "defaultLocale": { "type": "string", "maxLength": 16 },
        "supportedLocales": {
          "type": "array",
          "items": { "type": "string", "maxLength": 16 },
          "maxItems": 64
        },
        "stringTableRef": {
          "description": "External string table for i18nString keys used in this page, so a published experience can be localized without editing content.",
          "type": "string",
          "maxLength": 256
        }
      },
      "additionalProperties": false
    },

    "performance": {
      "type": "object",
      "properties": {
        "renderBudgetMs": { "type": "integer", "minimum": 100, "maximum": 30000 },
        "maxEagerDataSources": {
          "description": "Fan-out cap for the first batch. Excess sources are deferred rather than dropped, and the deferral is recorded — silent truncation would make a page appear complete when it is not.",
          "type": "integer",
          "minimum": 1,
          "maximum": 24
        },
        "autoRefreshSeconds": { "type": "integer", "minimum": 15, "maximum": 86400 }
      },
      "additionalProperties": false
    },

    "version": { "$ref": "versioning.schema.json#/$defs/versionEnvelope" },

    "tags": { "$ref": "common.schema.json#/$defs/tags" }
  },

  "required": ["schemaVersion", "id", "name", "kind", "layout", "components", "version"],
  "additionalProperties": false,

  "$defs": {

    "pageParameter": {
      "type": "object",
      "properties": {
        "label": { "$ref": "common.schema.json#/$defs/i18nString" },
        "dataType": { "$ref": "common.schema.json#/$defs/dataType" },
        "required": { "type": "boolean", "default": false },
        "multiValued": { "type": "boolean", "default": false },
        "default": { "$ref": "common.schema.json#/$defs/computableValue" },

        "scope": {
          "description": "'page' resets on navigation. 'experience' persists across pages within the experience, which is how an as-of date chosen on a dashboard survives a drill into detail instead of silently resetting. 'session' persists for the whole session.",
          "type": "string",
          "enum": ["page", "experience", "session"],
          "default": "page"
        },

        "syncToUrl": { "type": "boolean", "default": true },

        "boundToEntity": {
          "description": "Catalog entity this parameter identifies an instance of. Present on detail-page key parameters so the platform can label the record, resolve breadcrumbs and validate drill-down mappings without the author restating the relationship.",
          "$ref": "common.schema.json#/$defs/qualifiedRef"
        },
        "boundToAttribute": { "$ref": "common.schema.json#/$defs/qualifiedRef" },

        "allowedValues": {
          "description": "Constrains accepted values. Validated server-side on page load: a parameter arriving from a URL is user input and is never trusted, though it is also never a security boundary — entitlement is enforced independently by the gateway.",
          "type": "array",
          "items": { "type": ["string", "number", "boolean"] },
          "maxItems": 500
        },
        "description": { "$ref": "common.schema.json#/$defs/i18nString" }
      },
      "required": ["dataType"],
      "additionalProperties": false
    },

    "filterChannel": {
      "type": "object",
      "properties": {
        "label": { "$ref": "common.schema.json#/$defs/i18nString" },
        "dataType": { "$ref": "common.schema.json#/$defs/dataType" },
        "multiValued": { "type": "boolean", "default": false },
        "default": { "$ref": "common.schema.json#/$defs/computableValue" },

        "boundToAttribute": {
          "description": "Catalog attribute this channel filters. Lets the platform generate the filter control, its label and its value list from the catalog — including real enum values, so a generated filter offers actual values rather than plausible invented ones.",
          "$ref": "common.schema.json#/$defs/qualifiedRef"
        },

        "syncToUrl": { "type": "boolean", "default": true },
        "persist": {
          "description": "Remember the user's last value across visits.",
          "type": "string",
          "enum": ["none", "session", "user"],
          "default": "none"
        },
        "clearable": { "type": "boolean", "default": true },
        "description": { "$ref": "common.schema.json#/$defs/i18nString" }
      },
      "required": ["dataType"],
      "additionalProperties": false
    }
  }
}
