{
  "schemaVersion": "1.0",
  "id": "exception-management",
  "name": "Exception Management",
  "description": "The data quality remediation queue: what is broken, how badly, how long it has been broken, and which rule broke it.",
  "kind": "workspace",
  "tags": [
    "template",
    "data-quality",
    "remediation",
    "edm"
  ],
  "parameters": {
    "as-of": {
      "label": "As Of",
      "dataType": "date",
      "scope": "experience",
      "syncToUrl": true,
      "default": {
        "$expr": "today()"
      }
    },
    "age-threshold-hours": {
      "label": "Ageing Threshold (hours)",
      "dataType": "integer",
      "scope": "page",
      "syncToUrl": true,
      "default": 48,
      "description": "Breaks older than this count as ageing. A parameter rather than a constant, so a team can tune its own tolerance without a new page."
    }
  },
  "filters": {
    "query": {
      "label": "Search",
      "dataType": "string",
      "boundToAttribute": "dq.exception.security-name",
      "syncToUrl": true,
      "clearable": true,
      "description": "Free-text search over the security the break was raised against."
    },
    "severity": {
      "label": "Severity",
      "dataType": "enum",
      "multiValued": true,
      "boundToAttribute": "dq.exception.severity",
      "syncToUrl": true,
      "clearable": true
    },
    "status": {
      "label": "Status",
      "dataType": "enum",
      "multiValued": true,
      "boundToAttribute": "dq.exception.exception-status",
      "syncToUrl": true,
      "clearable": true
    },
    "asset-class": {
      "label": "Asset Class",
      "dataType": "enum",
      "multiValued": true,
      "boundToAttribute": "dq.exception.asset-class",
      "syncToUrl": true,
      "clearable": true
    },
    "active-rule": {
      "label": "Active Rule",
      "dataType": "string",
      "boundToAttribute": "dq.exception.rule-name",
      "syncToUrl": true,
      "clearable": false,
      "description": "Holds the active rule tab. The per-rule queue reads it, which is how one table serves every generated tab."
    }
  },
  "selections": {
    "focused-exception": {
      "label": "Focused Exception",
      "mode": "single",
      "entity": "dq.exception",
      "keyFields": [
        "exception-id"
      ]
    }
  },
  "dataSources": {
    "open-total": {
      "id": "open-total",
      "name": "Open",
      "entity": "dq.exception",
      "kind": "aggregate",
      "select": {
        "measures": [
          {
            "measure": "exception-count",
            "aggregation": "count",
            "alias": "open"
          }
        ]
      },
      "filter": {
        "all": [
          {
            "target": "security-name",
            "operator": "contains",
            "value": {
              "$filter": "query"
            },
            "caseSensitive": false
          },
          {
            "target": "severity",
            "operator": "in",
            "value": {
              "$filter": "severity"
            }
          },
          {
            "target": "exception-status",
            "operator": "in",
            "value": {
              "$filter": "status"
            }
          },
          {
            "target": "asset-class",
            "operator": "in",
            "value": {
              "$filter": "asset-class"
            }
          },
          {
            "target": "exception-status",
            "operator": "in",
            "value": [
              "OPEN",
              "IN_PROGRESS"
            ],
            "skipWhenEmpty": false
          }
        ]
      },
      "loadPolicy": "eager",
      "cacheTtlHintSeconds": 60
    },
    "high-severity": {
      "id": "high-severity",
      "name": "High Severity",
      "entity": "dq.exception",
      "kind": "aggregate",
      "select": {
        "measures": [
          {
            "measure": "exception-count",
            "aggregation": "count",
            "alias": "high"
          }
        ]
      },
      "filter": {
        "all": [
          {
            "target": "security-name",
            "operator": "contains",
            "value": {
              "$filter": "query"
            },
            "caseSensitive": false
          },
          {
            "target": "severity",
            "operator": "in",
            "value": {
              "$filter": "severity"
            }
          },
          {
            "target": "exception-status",
            "operator": "in",
            "value": {
              "$filter": "status"
            }
          },
          {
            "target": "asset-class",
            "operator": "in",
            "value": {
              "$filter": "asset-class"
            }
          },
          {
            "target": "severity",
            "operator": "eq",
            "value": "HIGH",
            "skipWhenEmpty": false
          },
          {
            "target": "exception-status",
            "operator": "in",
            "value": [
              "OPEN",
              "IN_PROGRESS"
            ],
            "skipWhenEmpty": false
          }
        ]
      },
      "loadPolicy": "eager",
      "cacheTtlHintSeconds": 60
    },
    "ageing": {
      "id": "ageing",
      "name": "Ageing",
      "entity": "dq.exception",
      "kind": "aggregate",
      "select": {
        "measures": [
          {
            "measure": "exception-count",
            "aggregation": "count",
            "alias": "ageing"
          }
        ]
      },
      "filter": {
        "all": [
          {
            "target": "security-name",
            "operator": "contains",
            "value": {
              "$filter": "query"
            },
            "caseSensitive": false
          },
          {
            "target": "severity",
            "operator": "in",
            "value": {
              "$filter": "severity"
            }
          },
          {
            "target": "exception-status",
            "operator": "in",
            "value": {
              "$filter": "status"
            }
          },
          {
            "target": "asset-class",
            "operator": "in",
            "value": {
              "$filter": "asset-class"
            }
          },
          {
            "target": "age-hours",
            "operator": "gte",
            "value": {
              "$param": "age-threshold-hours"
            },
            "skipWhenEmpty": false
          },
          {
            "target": "exception-status",
            "operator": "in",
            "value": [
              "OPEN",
              "IN_PROGRESS"
            ],
            "skipWhenEmpty": false
          }
        ]
      },
      "loadPolicy": "eager",
      "cacheTtlHintSeconds": 60
    },
    "oldest": {
      "id": "oldest",
      "name": "Oldest",
      "entity": "dq.exception",
      "kind": "aggregate",
      "select": {
        "measures": [
          {
            "measure": "age-hours",
            "aggregation": "max",
            "alias": "oldest"
          }
        ]
      },
      "filter": {
        "all": [
          {
            "target": "security-name",
            "operator": "contains",
            "value": {
              "$filter": "query"
            },
            "caseSensitive": false
          },
          {
            "target": "severity",
            "operator": "in",
            "value": {
              "$filter": "severity"
            }
          },
          {
            "target": "exception-status",
            "operator": "in",
            "value": {
              "$filter": "status"
            }
          },
          {
            "target": "asset-class",
            "operator": "in",
            "value": {
              "$filter": "asset-class"
            }
          },
          {
            "target": "exception-status",
            "operator": "in",
            "value": [
              "OPEN",
              "IN_PROGRESS"
            ],
            "skipWhenEmpty": false
          }
        ]
      },
      "loadPolicy": "eager",
      "cacheTtlHintSeconds": 60
    },
    "by-severity": {
      "id": "by-severity",
      "name": "Breaks by Severity",
      "entity": "dq.exception",
      "kind": "aggregate",
      "select": {
        "measures": [
          {
            "measure": "exception-count",
            "aggregation": "count",
            "alias": "count"
          }
        ],
        "dimensions": [
          {
            "attribute": "detected-at",
            "alias": "detected-at",
            "label": "Detected",
            "granularity": "day"
          },
          {
            "attribute": "severity",
            "alias": "severity",
            "label": "Severity"
          }
        ]
      },
      "filter": {
        "all": [
          {
            "target": "security-name",
            "operator": "contains",
            "value": {
              "$filter": "query"
            },
            "caseSensitive": false
          },
          {
            "target": "severity",
            "operator": "in",
            "value": {
              "$filter": "severity"
            }
          },
          {
            "target": "exception-status",
            "operator": "in",
            "value": {
              "$filter": "status"
            }
          },
          {
            "target": "asset-class",
            "operator": "in",
            "value": {
              "$filter": "asset-class"
            }
          },
          {
            "target": "detected-at",
            "operator": "inLast",
            "value": 14,
            "unit": "day",
            "skipWhenEmpty": false
          }
        ]
      },
      "sort": [
        {
          "field": "detected-at",
          "direction": "asc"
        }
      ],
      "loadPolicy": "eager",
      "cacheTtlHintSeconds": 120
    },
    "rule-tabs": {
      "id": "rule-tabs",
      "name": "Failing Rules",